{
  "schemaVersion": "1.0.0",
  "tenantId": "demo-hvac-b",
  "tenantMode": "synthetic-demo",
  "facts": [
    {"factId": "b-brand-name", "kind": "brand", "value": "Cinderblock Climate Demo", "source": {"type": "demo-only", "ref": "VRE_SAFE_DEMO.md"}, "status": "verified"},
    {"factId": "b-service-heating", "kind": "service", "value": "Heating system maintenance", "source": {"type": "demo-only", "ref": "VRE_SAFE_DEMO.md"}, "status": "verified"},
    {"factId": "b-service-air-quality", "kind": "service", "value": "Indoor air quality consultation", "source": {"type": "demo-only", "ref": "VRE_SAFE_DEMO.md"}, "status": "verified"},
    {"factId": "b-contact-email", "kind": "contact", "value": "demo-b@example.invalid", "source": {"type": "demo-only", "ref": "VRE_SAFE_DEMO.md"}, "status": "verified"}
  ]
}
